{
  "task_id": "demo_checkpointed_step_loop_v1",
  "version": "v1.0",
  "status": "completed",
  "created_at": "2026-03-15T12:13:44.691708Z",
  "updated_at": "2026-03-15T12:24:21.414545Z",
  "contract": {
    "objective": "Demo: Checkpointed Step Loop v1 \u6062\u590d\u80fd\u529b\u6f14\u793a",
    "repository": "/tmp/demo_repo",
    "branch": "main",
    "acceptance_criteria": [
      "\u6b65\u9aa4\u53ef\u4ee5\u5728\u4e2d\u65ad\u540e\u6062\u590d",
      "\u4e0d\u4f1a\u91cd\u590d\u6267\u884c\u5df2\u5b8c\u6210\u7684\u6b65\u9aa4",
      "\u5b8c\u6210\u524d\u5fc5\u987b\u901a\u8fc7 Gate A/B/C \u9a8c\u8bc1"
    ]
  },
  "steps": [
    {
      "step_id": "S01",
      "status": "success",
      "attempts": 1,
      "started_at": null,
      "completed_at": "2026-03-15T12:13:44.694885Z",
      "error": null
    },
    {
      "step_id": "S02",
      "status": "success",
      "attempts": 1,
      "started_at": null,
      "completed_at": "2026-03-15T12:24:21.412518Z",
      "error": null
    },
    {
      "step_id": "S03",
      "status": "success",
      "attempts": 1,
      "started_at": null,
      "completed_at": "2026-03-15T12:24:21.414456Z",
      "error": null
    }
  ],
  "current_step": null,
  "blocked_on": null,
  "artifacts_dir": "artifacts/tasks/demo_checkpointed_step_loop_v1",
  "ledger_path": "artifacts/tasks/demo_checkpointed_step_loop_v1/ledger.jsonl",
  "metadata": {}
}